{
  "start_time": "2026-05-04 11:29:15",
  "end_time": "2026-05-04 11:29:15",
  "status": "success",
  "error_code": null,
  "environment": {
    "python": "E:\\HTHao\\Internship\\Document-Digitizer-System\\pipeline\\.venv\\Scripts\\python.exe",
    "platform": "win32"
  },
  "io": {
    "input_dir": "E:\\HTHao\\Internship\\Document-Digitizer-System\\pipeline\\tests\\_tmp\\data\\input",
    "output_dir": "E:\\HTHao\\Internship\\Document-Digitizer-System\\pipeline\\tests\\_tmp\\data\\output",
    "json_dir": "E:\\HTHao\\Internship\\Document-Digitizer-System\\pipeline\\tests\\_tmp\\data\\json"
  },
  "steps": [
    {
      "name": "preprocess",
      "status": "dry-run",
      "return_code": 0,
      "duration_sec": 0.0,
      "stdout": "",
      "stderr": "",
      "input_dir": "E:\\HTHao\\Internship\\Document-Digitizer-System\\pipeline\\tests\\_tmp\\data\\input",
      "output_dir": "E:\\HTHao\\Internship\\Document-Digitizer-System\\pipeline\\data\\output\\preprocess",
      "json_dir": "E:\\HTHao\\Internship\\Document-Digitizer-System\\pipeline\\data\\json\\preprocess",
      "input_files": 1,
      "input_by_extension": {
        ".png": 1
      }
    },
    {
      "name": "ocr",
      "status": "dry-run",
      "return_code": 0,
      "duration_sec": 0.0,
      "stdout": "",
      "stderr": "",
      "input_dir": "E:\\HTHao\\Internship\\Document-Digitizer-System\\pipeline\\data\\output\\preprocess",
      "json_dir": "E:\\HTHao\\Internship\\Document-Digitizer-System\\pipeline\\data\\json\\ocr",
      "line_dir": "E:\\HTHao\\Internship\\Document-Digitizer-System\\pipeline\\data\\lines",
      "input_files": 8,
      "input_by_extension": {
        ".png": 8
      }
    }
  ],
  "warnings": [],
  "skipped_modules": [],
  "duration_sec": 0.003,
  "summary": {
    "total_steps": 2,
    "total_input_files": 9,
    "total_output_files": 0,
    "total_json_files": 0
  }
}